{
    "outline_metadata": {
        "total_scenes": 10,
        "total_target_words": 4500,
        "estimated_runtime_minutes": 30,
        "narrative_structure": "Setup-Rising Action-Crisis-Resolution-Legacy (Historical/Narrative genre)",
        "genre_from_blueprint": "HISTORICAL/NARRATIVE"
    },
    "scenes": [
        {
            "scene_number": 1,
            "scene_title": "The Data Dark Ages: Navigating a Labyrinth",
            "narrative_function": "HOOK + PROBLEM SETUP",
            "target_word_count": 450,
            "tone": "Intriguing, frustrating",
            "energy_level": 8,
            "must_include_from_research": [
                "Description of pre-relational data management (hierarchical/network databases like IMS, CODASYL)",
                "Specific anecdote: manufacturing company's 'data nightmare' (weeks/months for a report)",
                "Concept of tightly coupled applications and physical storage",
                "Cost of mainframe operations (hundreds of dollars per minute)"
            ],
            "key_story_elements": [
                "Open with the 'data nightmare' anecdote to immerse the listener in the problem.",
                "Paint a vivid picture of the complexity and rigidity of pre-SQL systems.",
                "Use the 'filing cabinet' analogy to illustrate the navigational challenges.",
                "Emphasize the human cost: frustration of programmers, business agility lost."
            ],
            "technical_depth": "MINIMAL - Focus on pain points and consequences, not technical specifics of old systems.",
            "transition_to_next": "Question: 'But what if there was a completely different way to organize information?'",
            "scriptwriter_guidance": "Start with a compelling, human story of struggle. Make the listener feel the frustration of the 'data dark ages.' Use the 'filing cabinet' analogy early to ground the technical difficulty."
        },
        {
            "scene_number": 2,
            "scene_title": "Codd's Radical Idea: A Relational Revelation",
            "narrative_function": "INTRODUCTION OF SOLUTION (THEORY)",
            "target_word_count": 450,
            "tone": "Intellectual, visionary",
            "energy_level": 6,
            "must_include_from_research": [
                "Edgar F. Codd and his 1970 paper, 'A Relational Model of Data for Large Shared Data Banks'",
                "Core principles: data in simple two-dimensional tables ('relations'), relationships by shared values, not pointers",
                "Concept of divorcing logical organization from physical storage (data independence)",
                "Codd's quote: 'Future users... protected from having to know how the data is organized...'"
            ],
            "key_story_elements": [
                "Introduce Codd as a quiet IBM scientist with a revolutionary idea.",
                "Explain the simplicity of tables, rows, and columns as a radical departure.",
                "Emphasize the 'declarative' vs. 'procedural' shift at a high level.",
                "Highlight the 'aha moment' of data independence."
            ],
            "technical_depth": "LOW - Focus on the conceptual breakthrough, using simple analogies for tables.",
            "transition_to_next": "Cliffhanger: 'This was a brilliant theory on paper, but could it actually work in the real world?'",
            "scriptwriter_guidance": "This scene is about a conceptual leap. Make Codd sound like a visionary. Use the 'spreadsheet' analogy to simplify the 'table' concept. Build anticipation for the practical implementation."
        },
        {
            "scene_number": 3,
            "scene_title": "IBM's System R: The Proof of Concept",
            "narrative_function": "RISING ACTION + CHALLENGE",
            "target_word_count": 450,
            "tone": "Determined, experimental",
            "energy_level": 7,
            "must_include_from_research": [
                "IBM's System R project (started 1973, San Jose Research Lab)",
                "Mission: build 'industrial-strength implementation' to prove viability",
                "Initial skepticism about performance and scalability of relational model",
                "Key researchers: Donald D. Chamberlin, Raymond F. Boyce, Patricia Selinger"
            ],
            "key_story_elements": [
                "Frame System R as IBM's ambitious answer to Codd's theory.",
                "Describe the challenge: translating abstract math into a working system.",
                "Acknowledge the industry's doubts and the internal resistance within IBM (protecting IMS).",
                "Introduce the team that would build the language."
            ],
            "technical_depth": "LOW - Focus on the project's goals, challenges, and key players.",
            "transition_to_next": "Question: 'So, how did they take Codd's vision of tables and turn it into a language people could actually use?'",
            "scriptwriter_guidance": "This scene builds tension. Emphasize the high stakes for IBM and the researchers. It's a story of engineering daring. Don't get bogged down in technical details here."
        },
        {
            "scene_number": 4,
            "scene_title": "SEQUEL: Ordering Data Like a Restaurant Meal",
            "narrative_function": "EXPLANATION (SIMPLE LAYER) + LANGUAGE BIRTH",
            "target_word_count": 450,
            "tone": "Clear, accessible, empowering",
            "energy_level": 6,
            "must_include_from_research": [
                "Development of SEQUEL (Structured English Query Language) in 1974 by Chamberlin and Boyce",
                "Design philosophy: high-level, English-like, declarative ('what' not 'how')",
                "Analogy: 'The Restaurant Order' (declarative vs. procedural)",
                "Basic concepts: tables, rows, columns, primary/foreign keys (simplified)"
            ],
            "key_story_elements": [
                "Introduce SEQUEL as the first practical query language for the relational model.",
                "Use the 'Restaurant Order' analogy to explain declarative querying simply.",
                "Walk through a simplified example of asking for data (without full syntax yet).",
                "Highlight how this simplified interaction for users."
            ],
            "technical_depth": "LOW - Introduce core concepts with strong analogies, avoiding jargon.",
            "transition_to_next": "Bridge: 'But behind that simple request, a sophisticated engine was at work, figuring out the most efficient way to get your data.'",
            "scriptwriter_guidance": "This is the 'aha' moment for the language itself. Keep it light and use the analogy heavily. Show, don't just tell, how it simplifies things compared to Scene 1."
        },
        {
            "scene_number": 5,
            "scene_title": "The Unseen Genius: Query Optimization",
            "narrative_function": "EXPLANATION (INTERMEDIATE/EXPERT LAYER) + BREAKTHROUGH",
            "target_word_count": 450,
            "tone": "Insightful, revealing",
            "energy_level": 5,
            "must_include_from_research": [
                "Performance challenges and how they were addressed in System R",
                "Patricia Selinger and the cost-based query optimizer (developed in System R)",
                "Analogy: 'The Librarian and the Card Catalog' (as the smart system that figures out 'how')",
                "Brief 'tour' through a simple SEQUEL query (`SELECT`, `FROM`, `WHERE`) explaining each keyword's purpose."
            ],
            "key_story_elements": [
                "Explain that the real magic was in the *optimizer* that made declarative queries fast.",
                "Introduce Patricia Selinger's pivotal role in developing the cost-based optimizer.",
                "Use the 'Librarian/Card Catalog' analogy to explain the optimizer's function.",
                "Show the simple `SELECT` query example from research and break down its parts, linking to Codd's relational algebra concepts (projection, selection)."
            ],
            "technical_depth": "MEDIUM - Introduce key technical components like the optimizer and basic query structure.",
            "transition_to_next": "Contrast: 'Despite these breakthroughs, not everyone was convinced. A fierce debate was brewing in the database world.'",
            "scriptwriter_guidance": "This scene layers in more technical detail but keeps it grounded. The query optimizer is a hero here. Make Selinger's contribution clear. The query tour should be a 'show-and-tell' moment."
        },
        {
            "scene_number": 6,
            "scene_title": "The Great Database War: Relational vs. The Old Guard",
            "narrative_function": "CONFLICT + CONTROVERSY",
            "target_word_count": 450,
            "tone": "Contentious, historical debate",
            "energy_level": 7,
            "must_include_from_research": [
                "Main arguments for and against relational databases (and SEQUEL/SQL) in mid-to-late 1970s",
                "Critic position: established vendors (CODASYL DBTG), perceived performance, fine-grained control",
                "Supporter response: data independence, flexibility, ease of use (Don Chamberlin quote)",
                "1 specific example of a competing database model (CODASYL DBTG) and its perceived strengths/weaknesses"
            ],
            "key_story_elements": [
                "Set the stage for a 'clash of titans' in the database world.",
                "Present the strongest arguments from both sides fairly.",
                "Use quotes from both critics and proponents to bring the debate to life.",
                "Explain why the old guard (e.g., CODASYL) resisted the change."
            ],